<?xml version="1.0" encoding="UTF-8"?>
<albums xmlns:xsi="http://www.w3.org/2001/XMLSchema-instance" xmlns="kappa" xsi:schemaLocation="kappa teht9.xsd">
    <album>
        <name>Kop kop kop</name>
        <artist>Kake Randelin</artist>
        <tracks>
            <track>Track 1</track>
            <track>Track 2</track>
            <track>Track 3</track>
        </tracks>
        <price>69,99</price>
    </album>
    <album>
        <name>Kiikun kaakun</name>
        <artist>Jope Ruonansuu</artist>
        <tracks>
            <track>Track 1</track>
        </tracks>
    </album>
</albums>